platform,emulator_name,supported_os,homepage,winget_id,homebrew_formula,flatpak_id,retroarch_core,save_directory,save_extensions,notes
Sony Playstation,DuckStation,Windows;Linux;macOS;Android,https://duckstation.org/,Stenzek.DuckStation,,org.duckstation.DuckStation,swanstation,~/.local/share/duckstation/memcards,.mcd,Primary recommendation with 99.17% compatibility. RetroArch core is SwanStation (fork). Flatpak no longer maintained.
Sony Playstation,Mednafen,Windows;Linux;macOS,https://mednafen.github.io/,,mednafen,com.github.AmatCoder.mednaffe,beetle_psx;beetle_psx_hw,~/.mednafen/sav,.mcr,High accuracy emulator. Flatpak is Mednaffe GUI with Mednafen bundled. RetroArch cores are Beetle PSX and Beetle PSX HW.
Sony Playstation,XEBRA,Windows;Android,https://play.google.com/store/apps/details?id=com.dokutajigokusai.xebra,,,,,./BU00;./BU10,none,High accuracy Japanese emulator. Memory cards stored as BU00/BU10 files without extension. Supports PocketStation.
Sony Playstation,BizHawk,Windows;Linux,https://github.com/TASEmulators/BizHawk,,,,nymashock,./PSX/SaveRAM,.SaveRAM,Tool-assisted speedrun focused. Uses Mednafen's Nymashock/Octoshock core internally. Accepted by speedrun community.
Sony Playstation,PCSX-ReARMed,Windows;Linux;macOS;Android;iOS,https://github.com/notaz/pcsx_rearmed,,,,pcsx_rearmed,~/.config/retroarch/saves,.srm;.mcd,Optimized for ARM devices. Best for low-powered hardware. Uses HLE BIOS if no BIOS found.
